tcpdump: WARNING: eno1: no IPv4 address assigned
tcpdump: listening on eno1, link-type EN10MB (Ethernet), capture size 65535 bytes
14:28:52.296656 IP (tos 0x0, ttl 61, id 35733, offset 0, flags [DF], proto TCP (6), length 60)
    185.52.26.79.40706 > x.x.x.2.ssh: Flags [S], cksum 0xe03b (correct), seq 2225897626, win 29200, options [mss 1460,sackOK,TS val 207227663 ecr 0,nop,wscale 7], length 0
14:28:52.296740 IP (tos 0x0, ttl 64, id 0, offset 0, flags [DF], proto TCP (6), length 60)
    x.x.x.2.ssh > 185.52.26.79.40706: Flags [S.], cksum 0x3a1a (incorrect -> 0xe1ee), seq 447791600, ack 2225897627, win 28960, options [mss 1460,sackOK,TS val 26419448 ecr 207227663,nop,wscale 7], length 0
14:28:52.296923 IP (tos 0x0, ttl 61, id 35734, offset 0, flags [DF], proto TCP (6), length 52)
    185.52.26.79.40706 > x.x.x.2.ssh: Flags [.], cksum 0x80f6 (correct), ack 1, win 229, options [nop,nop,TS val 207227663 ecr 26419448], length 0
14:28:52.297348 IP (tos 0x0, ttl 61, id 35735, offset 0, flags [DF], proto TCP (6), length 75)
    185.52.26.79.40706 > x.x.x.2.ssh: Flags [P.], cksum 0x8aff (correct), seq 1:24, ack 1, win 229, options [nop,nop,TS val 207227664 ecr 26419448], length 23
14:28:52.297380 IP (tos 0x0, ttl 64, id 57608, offset 0, flags [DF], proto TCP (6), length 52)
    x.x.x.2.ssh > 185.52.26.79.40706: Flags [.], cksum 0x3a12 (incorrect -> 0x80df), ack 24, win 227, options [nop,nop,TS val 26419449 ecr 207227664], length 0
14:28:52.310996 IP (tos 0x0, ttl 64, id 57609, offset 0, flags [DF], proto TCP (6), length 75)
    x.x.x.2.ssh > 185.52.26.79.40706: Flags [P.], cksum 0x3a29 (incorrect -> 0x8adb), seq 1:24, ack 24, win 227, options [nop,nop,TS val 26419463 ecr 207227664], length 23
14:28:52.311192 IP (tos 0x0, ttl 61, id 35736, offset 0, flags [DF], proto TCP (6), length 52)
    185.52.26.79.40706 > x.x.x.2.ssh: Flags [.], cksum 0x80ab (correct), ack 24, win 229, options [nop,nop,TS val 207227677 ecr 26419463], length 0
14:28:52.311773 IP (tos 0x0, ttl 61, id 35737, offset 0, flags [DF], proto TCP (6), length 2020)
    185.52.26.79.40706 > x.x.x.2.ssh: Flags [P.], cksum 0x41c2 (incorrect -> 0x0b27), seq 24:1992, ack 24, win 229, options [nop,nop,TS val 207227678 ecr 26419463], length 1968
14:28:52.311817 IP (tos 0x0, ttl 64, id 57610, offset 0, flags [DF], proto TCP (6), length 52)
    x.x.x.2.ssh > 185.52.26.79.40706: Flags [.], cksum 0x3a12 (incorrect -> 0x78de), ack 1992, win 257, options [nop,nop,TS val 26419463 ecr 207227678], length 0
14:28:52.314606 IP (tos 0x0, ttl 64, id 57611, offset 0, flags [DF], proto TCP (6), length 1692)
    x.x.x.2.ssh > 185.52.26.79.40706: Flags [P.], cksum 0x407a (incorrect -> 0x59fb), seq 24:1664, ack 1992, win 257, options [nop,nop,TS val 26419466 ecr 207227678], length 1640
14:28:52.314852 IP (tos 0x0, ttl 61, id 35739, offset 0, flags [DF], proto TCP (6), length 52)
    185.52.26.79.40706 > x.x.x.2.ssh: Flags [.], cksum 0x7273 (correct), ack 1664, win 254, options [nop,nop,TS val 207227681 ecr 26419466], length 0
14:28:52.317074 IP (tos 0x0, ttl 61, id 35740, offset 0, flags [DF], proto TCP (6), length 100)
    185.52.26.79.40706 > x.x.x.2.ssh: Flags [P.], cksum 0xf098 (correct), seq 1992:2040, ack 1664, win 254, options [nop,nop,TS val 207227683 ecr 26419466], length 48
14:28:52.327755 IP (tos 0x0, ttl 64, id 57613, offset 0, flags [DF], proto TCP (6), length 332)
    x.x.x.2.ssh > 185.52.26.79.40706: Flags [P.], cksum 0x3b2a (incorrect -> 0x7a0c), seq 1664:1944, ack 2040, win 257, options [nop,nop,TS val 26419479 ecr 207227683], length 280
14:28:52.331320 IP (tos 0x0, ttl 61, id 35741, offset 0, flags [DF], proto TCP (6), length 68)
    185.52.26.79.40706 > x.x.x.2.ssh: Flags [P.], cksum 0x66bd (correct), seq 2040:2056, ack 1944, win 277, options [nop,nop,TS val 207227698 ecr 26419479], length 16
14:28:52.370965 IP (tos 0x0, ttl 64, id 57614, offset 0, flags [DF], proto TCP (6), length 52)
    x.x.x.2.ssh > 185.52.26.79.40706: Flags [.], cksum 0x3a12 (incorrect -> 0x70ce), ack 2056, win 257, options [nop,nop,TS val 26419523 ecr 207227698], length 0
14:28:52.371152 IP (tos 0x0, ttl 61, id 35742, offset 0, flags [DF], proto TCP (6), length 104)
    185.52.26.79.40706 > x.x.x.2.ssh: Flags [P.], cksum 0x50de (correct), seq 2056:2108, ack 1944, win 277, options [nop,nop,TS val 207227737 ecr 26419523], length 52
14:28:52.371180 IP (tos 0x0, ttl 64, id 57615, offset 0, flags [DF], proto TCP (6), length 52)
    x.x.x.2.ssh > 185.52.26.79.40706: Flags [.], cksum 0x3a12 (incorrect -> 0x7073), ack 2108, win 257, options [nop,nop,TS val 26419523 ecr 207227737], length 0
14:28:52.371268 IP (tos 0x0, ttl 64, id 57616, offset 0, flags [DF], proto TCP (6), length 104)
    x.x.x.2.ssh > 185.52.26.79.40706: Flags [P.], cksum 0x3a46 (incorrect -> 0xf00d), seq 1944:1996, ack 2108, win 257, options [nop,nop,TS val 26419523 ecr 207227737], length 52
14:28:52.371443 IP (tos 0x0, ttl 61, id 35743, offset 0, flags [DF], proto TCP (6), length 120)
    185.52.26.79.40706 > x.x.x.2.ssh: Flags [P.], cksum 0x4f77 (correct), seq 2108:2176, ack 1996, win 277, options [nop,nop,TS val 207227738 ecr 26419523], length 68
14:28:52.374422 IP (tos 0x0, ttl 64, id 57617, offset 0, flags [DF], proto TCP (6), length 136)
    x.x.x.2.ssh > 185.52.26.79.40706: Flags [P.], cksum 0x3a66 (incorrect -> 0xa995), seq 1996:2080, ack 2176, win 257, options [nop,nop,TS val 26419526 ecr 207227738], length 84
14:28:52.376393 IP (tos 0x0, ttl 61, id 35744, offset 0, flags [DF], proto TCP (6), length 424)
    185.52.26.79.40706 > x.x.x.2.ssh: Flags [P.], cksum 0xa2c8 (correct), seq 2176:2548, ack 2080, win 277, options [nop,nop,TS val 207227743 ecr 26419526], length 372
14:28:52.379767 IP (tos 0x0, ttl 64, id 57618, offset 0, flags [DF], proto TCP (6), length 376)
    x.x.x.2.ssh > 185.52.26.79.40706: Flags [P.], cksum 0x3b56 (incorrect -> 0xc8af), seq 2080:2404, ack 2548, win 280, options [nop,nop,TS val 26419531 ecr 207227743], length 324
14:28:52.381843 IP (tos 0x0, ttl 61, id 35745, offset 0, flags [DF], proto TCP (6), length 696)
    185.52.26.79.40706 > x.x.x.2.ssh: Flags [P.], cksum 0xd966 (correct), seq 2548:3192, ack 2404, win 299, options [nop,nop,TS val 207227748 ecr 26419531], length 644
14:28:52.384162 IP (tos 0x0, ttl 64, id 57619, offset 0, flags [DF], proto TCP (6), length 88)
    x.x.x.2.ssh > 185.52.26.79.40706: Flags [P.], cksum 0x3a36 (incorrect -> 0xd5ec), seq 2404:2440, ack 3192, win 303, options [nop,nop,TS val 26419536 ecr 207227748], length 36
14:28:52.384378 IP (tos 0x0, ttl 61, id 35746, offset 0, flags [DF], proto TCP (6), length 172)
    185.52.26.79.40706 > x.x.x.2.ssh: Flags [P.], cksum 0x3923 (correct), seq 3192:3312, ack 2440, win 299, options [nop,nop,TS val 207227751 ecr 26419536], length 120
14:28:52.393346 IP (tos 0x0, ttl 64, id 57620, offset 0, flags [DF], proto TCP (6), length 104)
    x.x.x.2.ssh > 185.52.26.79.40706: Flags [P.], cksum 0x3a46 (incorrect -> 0xc08f), seq 2440:2492, ack 3312, win 303, options [nop,nop,TS val 26419545 ecr 207227751], length 52
14:28:52.393646 IP (tos 0x10, ttl 61, id 35747, offset 0, flags [DF], proto TCP (6), length 1376)
    185.52.26.79.40706 > x.x.x.2.ssh: Flags [P.], cksum 0x45cb (correct), seq 3312:4636, ack 2492, win 299, options [nop,nop,TS val 207227760 ecr 26419545], length 1324
14:28:52.394769 IP (tos 0x10, ttl 64, id 57621, offset 0, flags [DF], proto TCP (6), length 160)
    x.x.x.2.ssh > 185.52.26.79.40706: Flags [P.], cksum 0x3a7e (incorrect -> 0x82ac), seq 2492:2600, ack 4636, win 325, options [nop,nop,TS val 26419546 ecr 207227760], length 108
14:28:52.397789 IP (tos 0x10, ttl 64, id 57622, offset 0, flags [DF], proto TCP (6), length 184)
    x.x.x.2.ssh > 185.52.26.79.40706: Flags [P.], cksum 0x3a96 (incorrect -> 0xda76), seq 2600:2732, ack 4636, win 325, options [nop,nop,TS val 26419549 ecr 207227760], length 132
14:28:52.397992 IP (tos 0x10, ttl 61, id 35748, offset 0, flags [DF], proto TCP (6), length 52)
    185.52.26.79.40706 > x.x.x.2.ssh: Flags [.], cksum 0x630c (correct), ack 2732, win 322, options [nop,nop,TS val 207227764 ecr 26419546], length 0
14:28:52.548464 IP (tos 0x10, ttl 64, id 57623, offset 0, flags [DF], proto TCP (6), length 120)
    x.x.x.2.ssh > 185.52.26.79.40706: Flags [P.], cksum 0x3a56 (incorrect -> 0xbe03), seq 2732:2800, ack 4636, win 325, options [nop,nop,TS val 26419700 ecr 207227764], length 68
14:28:52.548855 IP (tos 0x10, ttl 64, id 57624, offset 0, flags [DF], proto TCP (6), length 120)
    x.x.x.2.ssh > 185.52.26.79.40706: Flags [P.], cksum 0x3a56 (incorrect -> 0x2d4c), seq 2800:2868, ack 4636, win 325, options [nop,nop,TS val 26419700 ecr 207227764], length 68
14:28:52.549035 IP (tos 0x10, ttl 61, id 35749, offset 0, flags [DF], proto TCP (6), length 52)
    185.52.26.79.40706 > x.x.x.2.ssh: Flags [.], cksum 0x6153 (correct), ack 2868, win 322, options [nop,nop,TS val 207227915 ecr 26419700], length 0
14:28:53.854128 IP (tos 0x10, ttl 61, id 35750, offset 0, flags [DF], proto TCP (6), length 88)
    185.52.26.79.40706 > x.x.x.2.ssh: Flags [P.], cksum 0x650f (correct), seq 4636:4672, ack 2868, win 322, options [nop,nop,TS val 207229220 ecr 26419700], length 36
14:28:53.854452 IP (tos 0x10, ttl 64, id 57625, offset 0, flags [DF], proto TCP (6), length 88)
    x.x.x.2.ssh > 185.52.26.79.40706: Flags [P.], cksum 0x3a36 (incorrect -> 0x82fd), seq 2868:2904, ack 4672, win 325, options [nop,nop,TS val 26421006 ecr 207229220], length 36
14:28:53.894295 IP (tos 0x10, ttl 61, id 35751, offset 0, flags [DF], proto TCP (6), length 52)
    185.52.26.79.40706 > x.x.x.2.ssh: Flags [.], cksum 0x56af (correct), ack 2904, win 322, options [nop,nop,TS val 207229261 ecr 26421006], length 0
14:28:54.031079 IP (tos 0x10, ttl 61, id 35752, offset 0, flags [DF], proto TCP (6), length 88)
    185.52.26.79.40706 > x.x.x.2.ssh: Flags [P.], cksum 0xae5d (correct), seq 4672:4708, ack 2904, win 322, options [nop,nop,TS val 207229397 ecr 26421006], length 36
14:28:54.031325 IP (tos 0x10, ttl 64, id 57626, offset 0, flags [DF], proto TCP (6), length 88)
    x.x.x.2.ssh > 185.52.26.79.40706: Flags [P.], cksum 0x3a36 (incorrect -> 0xb399), seq 2904:2940, ack 4708, win 325, options [nop,nop,TS val 26421183 ecr 207229397], length 36
14:28:54.031511 IP (tos 0x10, ttl 61, id 35753, offset 0, flags [DF], proto TCP (6), length 52)
    185.52.26.79.40706 > x.x.x.2.ssh: Flags [.], cksum 0x552d (correct), ack 2940, win 322, options [nop,nop,TS val 207229398 ecr 26421183], length 0
14:28:54.589919 IP (tos 0x10, ttl 61, id 35754, offset 0, flags [DF], proto TCP (6), length 88)
    185.52.26.79.40706 > x.x.x.2.ssh: Flags [P.], cksum 0x0096 (correct), seq 4708:4744, ack 2940, win 322, options [nop,nop,TS val 207229956 ecr 26421183], length 36
14:28:54.590218 IP (tos 0x10, ttl 64, id 57627, offset 0, flags [DF], proto TCP (6), length 104)
    x.x.x.2.ssh > 185.52.26.79.40706: Flags [P.], cksum 0x3a46 (incorrect -> 0xc47e), seq 2940:2992, ack 4744, win 325, options [nop,nop,TS val 26421742 ecr 207229956], length 52
14:28:54.590401 IP (tos 0x10, ttl 61, id 35755, offset 0, flags [DF], proto TCP (6), length 52)
    185.52.26.79.40706 > x.x.x.2.ssh: Flags [.], cksum 0x5077 (correct), ack 2992, win 322, options [nop,nop,TS val 207229957 ecr 26421742], length 0
14:28:54.693588 IP (tos 0x10, ttl 61, id 35756, offset 0, flags [DF], proto TCP (6), length 88)
    185.52.26.79.40706 > x.x.x.2.ssh: Flags [P.], cksum 0x4007 (correct), seq 4744:4780, ack 2992, win 322, options [nop,nop,TS val 207230060 ecr 26421742], length 36
14:28:54.693835 IP (tos 0x10, ttl 64, id 57628, offset 0, flags [DF], proto TCP (6), length 104)
    x.x.x.2.ssh > 185.52.26.79.40706: Flags [P.], cksum 0x3a46 (incorrect -> 0xa68c), seq 2992:3044, ack 4780, win 325, options [nop,nop,TS val 26421845 ecr 207230060], length 52
14:28:54.694019 IP (tos 0x10, ttl 61, id 35757, offset 0, flags [DF], proto TCP (6), length 52)
    185.52.26.79.40706 > x.x.x.2.ssh: Flags [.], cksum 0x4f51 (correct), ack 3044, win 322, options [nop,nop,TS val 207230060 ecr 26421845], length 0
14:28:54.846126 IP (tos 0x10, ttl 61, id 35758, offset 0, flags [DF], proto TCP (6), length 88)
    185.52.26.79.40706 > x.x.x.2.ssh: Flags [P.], cksum 0xecb4 (correct), seq 4780:4816, ack 3044, win 322, options [nop,nop,TS val 207230212 ecr 26421845], length 36
14:28:54.846332 IP (tos 0x10, ttl 64, id 57629, offset 0, flags [DF], proto TCP (6), length 88)
    x.x.x.2.ssh > 185.52.26.79.40706: Flags [P.], cksum 0x3a36 (incorrect -> 0xf4b3), seq 3044:3080, ack 4816, win 325, options [nop,nop,TS val 26421998 ecr 207230212], length 36
14:28:54.846559 IP (tos 0x10, ttl 61, id 35759, offset 0, flags [DF], proto TCP (6), length 52)
    185.52.26.79.40706 > x.x.x.2.ssh: Flags [.], cksum 0x4dd7 (correct), ack 3080, win 322, options [nop,nop,TS val 207230213 ecr 26421998], length 0
14:28:55.230160 IP (tos 0x10, ttl 61, id 35760, offset 0, flags [DF], proto TCP (6), length 88)
    185.52.26.79.40706 > x.x.x.2.ssh: Flags [P.], cksum 0xc504 (correct), seq 4816:4852, ack 3080, win 322, options [nop,nop,TS val 207230596 ecr 26421998], length 36
14:28:55.230795 IP (tos 0x10, ttl 64, id 57630, offset 0, flags [DF], proto TCP (6), length 136)
    x.x.x.2.ssh > 185.52.26.79.40706: Flags [P.], cksum 0x3a66 (incorrect -> 0xdd03), seq 3080:3164, ack 4852, win 325, options [nop,nop,TS val 26422382 ecr 207230596], length 84
14:28:55.230980 IP (tos 0x10, ttl 61, id 35761, offset 0, flags [DF], proto TCP (6), length 52)
    185.52.26.79.40706 > x.x.x.2.ssh: Flags [.], cksum 0x4a5f (correct), ack 3164, win 322, options [nop,nop,TS val 207230597 ecr 26422382], length 0
14:28:55.321036 IP (tos 0x10, ttl 61, id 35762, offset 0, flags [DF], proto TCP (6), length 88)
    185.52.26.79.40706 > x.x.x.2.ssh: Flags [P.], cksum 0x9ebe (correct), seq 4852:4888, ack 3164, win 322, options [nop,nop,TS val 207230687 ecr 26422382], length 36
14:28:55.321547 IP (tos 0x10, ttl 64, id 57631, offset 0, flags [DF], proto TCP (6), length 136)
    x.x.x.2.ssh > 185.52.26.79.40706: Flags [P.], cksum 0x3a66 (incorrect -> 0x8252), seq 3164:3248, ack 4888, win 325, options [nop,nop,TS val 26422473 ecr 207230687], length 84
14:28:55.321735 IP (tos 0x10, ttl 61, id 35763, offset 0, flags [DF], proto TCP (6), length 52)
    185.52.26.79.40706 > x.x.x.2.ssh: Flags [.], cksum 0x4931 (correct), ack 3248, win 322, options [nop,nop,TS val 207230688 ecr 26422473], length 0
14:28:55.522237 IP (tos 0x10, ttl 61, id 35764, offset 0, flags [DF], proto TCP (6), length 88)
    185.52.26.79.40706 > x.x.x.2.ssh: Flags [P.], cksum 0xa736 (correct), seq 4888:4924, ack 3248, win 322, options [nop,nop,TS val 207230888 ecr 26422473], length 36
14:28:55.522922 IP (tos 0x10, ttl 64, id 57632, offset 0, flags [DF], proto TCP (6), length 136)
    x.x.x.2.ssh > 185.52.26.79.40706: Flags [P.], cksum 0x3a66 (incorrect -> 0x17c5), seq 3248:3332, ack 4924, win 325, options [nop,nop,TS val 26422674 ecr 207230888], length 84
14:28:55.523111 IP (tos 0x10, ttl 61, id 35765, offset 0, flags [DF], proto TCP (6), length 52)
    185.52.26.79.40706 > x.x.x.2.ssh: Flags [.], cksum 0x4727 (correct), ack 3332, win 322, options [nop,nop,TS val 207230889 ecr 26422674], length 0
14:28:55.646299 IP (tos 0x10, ttl 61, id 35766, offset 0, flags [DF], proto TCP (6), length 88)
    185.52.26.79.40706 > x.x.x.2.ssh: Flags [P.], cksum 0x88b5 (correct), seq 4924:4960, ack 3332, win 322, options [nop,nop,TS val 207231012 ecr 26422674], length 36
14:28:55.646823 IP (tos 0x10, ttl 64, id 57633, offset 0, flags [DF], proto TCP (6), length 136)
    x.x.x.2.ssh > 185.52.26.79.40706: Flags [P.], cksum 0x3a66 (incorrect -> 0xbef6), seq 3332:3416, ack 4960, win 325, options [nop,nop,TS val 26422798 ecr 207231012], length 84
14:28:55.647013 IP (tos 0x10, ttl 61, id 35767, offset 0, flags [DF], proto TCP (6), length 52)
    185.52.26.79.40706 > x.x.x.2.ssh: Flags [.], cksum 0x45b7 (correct), ack 3416, win 322, options [nop,nop,TS val 207231013 ecr 26422798], length 0
14:28:55.741110 IP (tos 0x10, ttl 61, id 35768, offset 0, flags [DF], proto TCP (6), length 88)
    185.52.26.79.40706 > x.x.x.2.ssh: Flags [P.], cksum 0xb50f (correct), seq 4960:4996, ack 3416, win 322, options [nop,nop,TS val 207231107 ecr 26422798], length 36
14:28:55.741605 IP (tos 0x10, ttl 64, id 57634, offset 0, flags [DF], proto TCP (6), length 136)
    x.x.x.2.ssh > 185.52.26.79.40706: Flags [P.], cksum 0x3a66 (incorrect -> 0xd90c), seq 3416:3500, ack 4996, win 325, options [nop,nop,TS val 26422893 ecr 207231107], length 84
14:28:55.741790 IP (tos 0x10, ttl 61, id 35769, offset 0, flags [DF], proto TCP (6), length 52)
    185.52.26.79.40706 > x.x.x.2.ssh: Flags [.], cksum 0x4481 (correct), ack 3500, win 322, options [nop,nop,TS val 207231108 ecr 26422893], length 0
14:29:05.687088 IP (tos 0x10, ttl 61, id 35770, offset 0, flags [DF], proto TCP (6), length 104)
    185.52.26.79.40706 > x.x.x.2.ssh: Flags [P.], cksum 0xda4a (correct), seq 4996:5048, ack 3500, win 322, options [nop,nop,TS val 207241053 ecr 26422893], length 52
14:29:05.687465 IP (tos 0x10, ttl 64, id 57635, offset 0, flags [DF], proto TCP (6), length 104)
    x.x.x.2.ssh > 185.52.26.79.40706: Flags [P.], cksum 0x3a46 (incorrect -> 0x5d24), seq 3500:3552, ack 5048, win 325, options [nop,nop,TS val 26432839 ecr 207241053], length 52
14:29:05.687647 IP (tos 0x10, ttl 61, id 35771, offset 0, flags [DF], proto TCP (6), length 52)
    185.52.26.79.40706 > x.x.x.2.ssh: Flags [.], cksum 0xf664 (correct), ack 3552, win 322, options [nop,nop,TS val 207241054 ecr 26432839], length 0
14:29:05.814003 IP (tos 0x10, ttl 61, id 35772, offset 0, flags [DF], proto TCP (6), length 104)
    185.52.26.79.40706 > x.x.x.2.ssh: Flags [P.], cksum 0x8d8e (correct), seq 5048:5100, ack 3552, win 322, options [nop,nop,TS val 207241180 ecr 26432839], length 52
14:29:05.814239 IP (tos 0x10, ttl 64, id 57636, offset 0, flags [DF], proto TCP (6), length 104)
    x.x.x.2.ssh > 185.52.26.79.40706: Flags [P.], cksum 0x3a46 (incorrect -> 0x26f9), seq 3552:3604, ack 5100, win 325, options [nop,nop,TS val 26432966 ecr 207241180], length 52
14:29:05.814425 IP (tos 0x10, ttl 61, id 35773, offset 0, flags [DF], proto TCP (6), length 52)
    185.52.26.79.40706 > x.x.x.2.ssh: Flags [.], cksum 0xf4fe (correct), ack 3604, win 322, options [nop,nop,TS val 207241181 ecr 26432966], length 0
14:29:07.086035 IP (tos 0x10, ttl 61, id 35774, offset 0, flags [DF], proto TCP (6), length 88)
    185.52.26.79.40706 > x.x.x.2.ssh: Flags [P.], cksum 0x4541 (correct), seq 5100:5136, ack 3604, win 322, options [nop,nop,TS val 207242452 ecr 26432966], length 36
14:29:07.086358 IP (tos 0x10, ttl 64, id 57637, offset 0, flags [DF], proto TCP (6), length 104)
    x.x.x.2.ssh > 185.52.26.79.40706: Flags [P.], cksum 0x3a46 (incorrect -> 0x1093), seq 3604:3656, ack 5136, win 325, options [nop,nop,TS val 26434238 ecr 207242452], length 52
14:29:07.086543 IP (tos 0x10, ttl 61, id 35775, offset 0, flags [DF], proto TCP (6), length 52)
    185.52.26.79.40706 > x.x.x.2.ssh: Flags [.], cksum 0xeab6 (correct), ack 3656, win 322, options [nop,nop,TS val 207242453 ecr 26434238], length 0
14:29:07.616200 IP (tos 0x10, ttl 61, id 35776, offset 0, flags [DF], proto TCP (6), length 88)
    185.52.26.79.40706 > x.x.x.2.ssh: Flags [P.], cksum 0x7f1f (correct), seq 5136:5172, ack 3656, win 322, options [nop,nop,TS val 207242982 ecr 26434238], length 36
14:29:07.616581 IP (tos 0x10, ttl 64, id 57638, offset 0, flags [DF], proto TCP (6), length 120)
    x.x.x.2.ssh > 185.52.26.79.40706: Flags [P.], cksum 0x3a56 (incorrect -> 0x0656), seq 3656:3724, ack 5172, win 325, options [nop,nop,TS val 26434768 ecr 207242982], length 68
14:29:07.616768 IP (tos 0x10, ttl 61, id 35777, offset 0, flags [DF], proto TCP (6), length 52)
    185.52.26.79.40706 > x.x.x.2.ssh: Flags [.], cksum 0xe62a (correct), ack 3724, win 322, options [nop,nop,TS val 207242983 ecr 26434768], length 0
14:29:08.966053 IP (tos 0x10, ttl 61, id 35778, offset 0, flags [DF], proto TCP (6), length 88)
    185.52.26.79.40706 > x.x.x.2.ssh